Clase,same_as_clase,PK,NOMBRE,DESCRIPCION-ENTIDAD,HORARIO,EQUIPAMIENTO,TRANSPORTE,DESCRIPCION,CONTENT-URL,DIRECCION,ParsedStreet,NUM,LOCALIDAD,same_as_localidad,PROVINCIA,same_as_provincia,CODIGO-POSTAL,ParsedPostal,BARRIO,same_as_barrio,DISTRITO,same_as_distrito,LATITUD,CoorParsed,LONGITUD,TELEFONO,EMAIL,TIPO,SUBTIPO,SubTipoParseado,FECHA,AUTORES,PDF
Spanish Museum,https://wikidata.org/entity/Q55188818,2084,Museo De Cera,NOConocido,Horario de verano (Mayo a Septiembre)  Taquilla: 11 a 20 horas Publico:  11 a 20:30 horas  Horario de invierno (Octubre a Abril)  Taquilla: de 11 a 18:30 horas Publico: de 11 a 19 horas,NOConocido,Metro: Colon (linea 4)  Bus: 14_ 150_ 27_ 45_ 5_ 53_ 21_ 37  Cercanias Renfe: Recoletos (lineas C1_ C2_ C7_ C10)  Bicimad: Estacion 10 (Calle Marques de la Ensenada_ 16)  Parking: Colon (2)_ Plaza de Colon s/n,NOConocido,http://www.madrid.es/sites/v/index.jsp?vgnextchannel=bfa48ab43d6bb410VgnVCM100000171f5a0aRCRD&vgnextoid=9689ef4d7f71c010VgnVCM1000000b205a0aRCRD,PASEO RECOLETOS,PaseoRecoletosNum72813,41,Madrid,https://wikidata.org/entity/Q2807,Community of Madrid,https://wikidata.org/entity/Q5756,28004,28004N10132,Justicia,https://wikidata.org/entity/Q1992319,Centro,https://wikidata.org/entity/Q1763376,40.424403779665376,424403779665376N7650,-3.6914362030084815,913 199 330,info@museoceramadrid.com,Museos,NoIdentificado,Noidentificado,NOConocido,NOConocido,NOConocido
Spanish Museum,https://wikidata.org/entity/Q55188818,2071,Museo De Escultura Al Aire Libre De La Castellana,El Museo de Escultura al Aire Libre de La Castellana_ esta situado bajo el paso elevado que une las calles de Juan Bravo y Eduardo Dato_ contiene una excelente coleccion de escultura abstracta española.,Entrada libre. Espacio urbano abierto Abierto 24 horas al dia los 365 dias del año.,NOConocido,Transporte publico mas proximo   Metro: Ruben Dario (linea 5)  Bus: 5_ 14_ 27_ 45_ 150  BICIMAD: Estacion 142 (Paseo de la Castellana n&amp;ordm;42),NOConocido,http://www.madrid.es/sites/v/index.jsp?vgnextchannel=bfa48ab43d6bb410VgnVCM100000171f5a0aRCRD&vgnextoid=eca9ef4d7f71c010VgnVCM1000000b205a0aRCRD,PASEO CASTELLANA,PaseoCastellanaNum63064,40,Madrid,https://wikidata.org/entity/Q2807,Community of Madrid,https://wikidata.org/entity/Q5756,28046,28046N60097,Castellana,https://wikidata.org/entity/Q4781,Salamanca,https://wikidata.org/entity/Q1773521,40.433219398671156,433219398671156N7379,-3.6876122680805956,915 885 921,mmacmdifusion@madrid.es,MonumentosEdificiosArtisticos,NoIdentificado,Noidentificado,NOConocido,NOConocido,NOConocido
Spanish Museum,https://wikidata.org/entity/Q55188818,2054,Museo De Historia De Madrid,Fue creado como museo municipal en 1929 y rebautizado como Museo de Historia de Madrid en 2007. En el año 2014 se hace una profunda remodelacion y reabre sus puertas con un montaje moderno y una puesta al dia de sus colecciones.,De martes a domingos de 10 a 20 horas.  Verano: de martes a domingos de 10 a 19 horas.  Cerrado: lunes y los dias 1 y 6 de enero_ 1 de mayo_  24_ 25 y 31 de diciembre.   El desalojo de las salas se hara diez minutos antes del cierre.,Biblioteca de investigacion Servicio de documentacion Guardarropa Zona wifi,Metro: Tribunal_ Bilbao y Alonso Martinez. Bus: 3_ 21_ 37_ 40_ 147 y 149. BICIMAD: Estacion 54 (Calle Barcelo 7) Aparcamiento publico: Barcelo.,Accesibilidad fisica:   Rampa de acceso a la entrada. Ascensores. Aseos adaptados. Silla de ruedas.,http://www.madrid.es/sites/v/index.jsp?vgnextchannel=bfa48ab43d6bb410VgnVCM100000171f5a0aRCRD&vgnextoid=8f3079262ef5d010VgnVCM1000000b205a0aRCRD,CALLE FUENCARRAL,CalleFuencarralNum48250,78,Madrid,https://wikidata.org/entity/Q2807,Community of Madrid,https://wikidata.org/entity/Q5756,28004,28004N95828,Justicia,https://wikidata.org/entity/Q1992319,Centro,https://wikidata.org/entity/Q1763376,40.42577054821346,42577054821346N8792,-3.700845660719608,917 011 863,smuseosm@madrid.es,MonumentosEdificiosArtisticos,NoIdentificado,Noidentificado,NOConocido,NOConocido,NOConocido
Spanish Museum,https://wikidata.org/entity/Q55188818,4545827,Museo De Historia De La Comunidad Judia De Madrid,NOConocido,NOConocido,Visitas guiadas   Para realizar las  visitas tiene que solicitarse previamente en el correo electronico info@cjmadrid.org_ aportando nombre_ apellidos y Documento Nacional de Identidad.,Metro: Iglesia (linea 1).  Bus: 16_ 61_ 3_ 37_ 149.  Bicimad: Estacion 246 (calle Santa Engracia_ 87).,NOConocido,http://www.madrid.es/sites/v/index.jsp?vgnextchannel=bfa48ab43d6bb410VgnVCM100000171f5a0aRCRD&vgnextoid=8f2a4a659ee71110VgnVCM1000000b205a0aRCRD,CALLE BALMES,CalleBalmesNum32960,3,Madrid,https://wikidata.org/entity/Q2807,Community of Madrid,https://wikidata.org/entity/Q5756,28010,28010N76452,Trafalgar,https://wikidata.org/entity/Q10384027,Chamberi,https://wikidata.org/entity/Q1763370,40.43534317115623,43534317115623N855,-3.700013620203689,915 913 131,info@cjmadrid.org,Museos,NoIdentificado,Noidentificado,NOConocido,NOConocido,NOConocido
Spanish Museum,https://wikidata.org/entity/Q55188818,2095,Museo De Mineralogia,Presenta colecciones de minerales clasificados por su composicion quimica y vitrinas murales con ejemplares de exhibicion procedentes de todo el mundo.,Martes_ miercoles y jueves_ de 12:30 a 14:30 horas Visitas guiadas o a otras horas_ concertando previamente en el telefono 913 974 132.,NOConocido,Renfe: Cantoblanco Universidad,NOConocido,http://www.madrid.es/sites/v/index.jsp?vgnextchannel=bfa48ab43d6bb410VgnVCM100000171f5a0aRCRD&vgnextoid=255aef4d7f71c010VgnVCM1000000b205a0aRCRD,CALLE FRANCISCO TOMAS Y VALIENTE,CalleFranciscoTomasYValienteNum51339,7,Madrid,https://wikidata.org/entity/Q2807,Community of Madrid,https://wikidata.org/entity/Q5756,28049,28049N90867,El-goloso,https://wikidata.org/entity/Q10271137,Fuencarral-El-Pardo,https://wikidata.org/entity/Q656196,40.54537941407227,54537941407227N9689,-3.6951833197962536,914 974 132,museo.mineralogia@uam.es,Museos,NoIdentificado,Noidentificado,NOConocido,NOConocido,NOConocido
Spanish Museum,https://wikidata.org/entity/Q55188818,2112,Museo De San Isidro. Los Origenes De Madrid,Este espacio museografico propone un viaje por la historia de la ciudad de Madrid desde la Prehistoria hasta el establecimiento de la Corte_ a traves de distintas salas como la de San Isidro_ el Patio renacentista_ el Jardin arqueobotanico o el Almacen visitable.,De martes a domingo y festivos de 10 a 20 horas.  Último pase de visita 15 minutos antes del cierre.    Verano_ del 16 de junio al 15 de septiembre: de martes a domingo de 10 a 19 horas.  Cerrado todos los lunes_ el 1 y 6 de enero_ el 1 de mayo y los dias 24_ 25 y 31 de diciembre.,Sala de investigadores. Biblioteca especializada en arqueologia e historia madrileña. Archivo documental. Almacen visitable con mas de 600 piezas arqueologicas. Jardin arqueobotanico_ con informacion documentada sobre las especies de la ciudad.  Investigadores: los fondos del Museo estan a disposicion de la comunidad cientifica y los investigadores podran acceder tramitando su correspondiente solicitud. Visitas guiadas por voluntarios culturales. Talleres didacticos para grupos escolares. Zona wifi (Almacen visitable y salon de actos),Metro: Latina _ Tirso de Molina Bus: 3 _ 17 _ 18 _ 23 _ 35 _ 60 _ 65 _ 148 BICIMAD: Estacion 38 (Carrera de San Francisco 1),NOConocido,http://www.madrid.es/sites/v/index.jsp?vgnextchannel=bfa48ab43d6bb410VgnVCM100000171f5a0aRCRD&vgnextoid=7b7aef4d7f71c010VgnVCM1000000b205a0aRCRD,PLAZA SAN ANDRES,PlazaSanAndresNum74770,1,Madrid,https://wikidata.org/entity/Q2807,Community of Madrid,https://wikidata.org/entity/Q5756,28005,28005N73529,Palacio,https://wikidata.org/entity/Q2136510,Centro,https://wikidata.org/entity/Q1763376,40.41207900253883,41207900253883N5426,-3.7108161027466378,913 667 415,museosanisidro@madrid.es,Museos,NoIdentificado,Noidentificado,NOConocido,NOConocido,NOConocido
Spanish Museum,https://wikidata.org/entity/Q55188818,85301,Museo De Sanidad E Higiene Publica,Con sede en el Instituto de Salud Carlos III_ ocupa las antiguas dependencias del Laboratorio de Microbiologia del Hospital del Rey. 300 m2 conservados tal cual su antiguo uso_ con fondos de mobiliario_ instrumental y bibliografia de los antiguos hospitales para enfermos infecciosos del complejo. Se resaltan hitos historicos relevantes en salud publica mediante laminas enmarcadas.,Solo visitas de grupo con cita previa: de lunes a viernes laborables_ de 10 a 14 horas.,Solicitud cita previa en telefono 918 222 414 o museodesanidad@isciii.es,Metro: Chamartin (lineas 1_ 10)_ Plaza de Castilla (1_ 9_ 10)  Bus: 134_ 137  Renfe: Chamartin,NOConocido,http://www.madrid.es/sites/v/index.jsp?vgnextchannel=bfa48ab43d6bb410VgnVCM100000171f5a0aRCRD&vgnextoid=3e755c2cdc41c010VgnVCM2000000c205a0aRCRD,AVENIDA MONFORTE DE LEMOS,AvenidaMonforteDeLemosNum91920,5,Madrid,https://wikidata.org/entity/Q2807,Community of Madrid,https://wikidata.org/entity/Q5756,28029,28029N44096,La-paz,https://wikidata.org/entity/Q5869740,Fuencarral-El-Pardo,https://wikidata.org/entity/Q656196,40.47546597881768,47546597881768N385,-3.6900603941123107,918 222 414,museodesanidad@iscii.es,Museos,NoIdentificado,Noidentificado,NOConocido,NOConocido,NOConocido
Spanish Museum,https://wikidata.org/entity/Q55188818,4591873,Museo De La Biblioteca Nacional De España,El Museo de la Biblioteca Nacional de España_ antiguo Museo del Libro_ es responsable de la oferta educativa_ formativa_ cultural y de ocio de la institucion y divulga las colecciones_ funcionamiento e historia de la Biblioteca para todos los publicos.,Temporalmente cerrado. Consultar calendario de cierre.,NOConocido,Metro: Colon_ (linea 4)_ Retiro (Linea 2)  Bus: 14_ 150_ 27_ 37_ 45_ 5_ 53_ C03.  Cercanias Renfe: Recoletos (lineas C1_ C2_ C7_ C8  y C10).  Bicimad: Estacion 94 (Paseo Recoletos_ 20)  Aparcamiento: Colon (2)_ plaza de Colon.,NOConocido,http://www.madrid.es/sites/v/index.jsp?vgnextchannel=bfa48ab43d6bb410VgnVCM100000171f5a0aRCRD&vgnextoid=05920d3b4c503110VgnVCM2000000c205a0aRCRD,PASEO RECOLETOS,PaseoRecoletosNum54623,20,Madrid,https://wikidata.org/entity/Q2807,Community of Madrid,https://wikidata.org/entity/Q5756,28001,28001N63323,Recoletos,https://wikidata.org/entity/Q3814551,Salamanca,https://wikidata.org/entity/Q1773521,40.423001908945956,423001908945956N4271,-3.69084423390357,915 168 967,museo@bne.es,Museos,NoIdentificado,Noidentificado,NOConocido,NOConocido,NOConocido
Spanish Museum,https://wikidata.org/entity/Q55188818,4566286,Museo De La Catedral De La Almudena,NOConocido,De lunes a sabado de 10 a 14:30 horas. Cerrado los domingos_ fiestas de precepto y dias de actos de culto especiales en la Catedral.,NOConocido,Bus: 3.  Metro: Ópera (Lineas 2_ 5 y Ramal Ópera Principe Pio).  Bicimad: Estacion 36 (plaza Ramales_ 1).,Imprescindible reserva previa en  reservasmuseo@catedraldelaalmudena.es o telefono 915 592 874,http://www.madrid.es/sites/v/index.jsp?vgnextchannel=bfa48ab43d6bb410VgnVCM100000171f5a0aRCRD&vgnextoid=82cb8d0e78d22110VgnVCM1000000b205a0aRCRD,CALLE BAILEN,CalleBailenNum716,10,Madrid,https://wikidata.org/entity/Q2807,Community of Madrid,https://wikidata.org/entity/Q5756,28013,28013N6358,Palacio,https://wikidata.org/entity/Q2136510,Centro,https://wikidata.org/entity/Q1763376,40.415538770017406,415538770017406N2358,-3.7136931154460564,915 592 874,reservasmuseo@catedraldelaalmudena.es,Museos,NoIdentificado,Noidentificado,NOConocido,NOConocido,NOConocido
Spanish Museum,https://wikidata.org/entity/Q55188818,2073,Museo De La Farmacia Hispana,NOConocido,El Museo de la Farmacia Hispana solo puede visitarse realizando una reserva con antelacion.La visita es gratuita_ guiada y tiene una duracion aproximada de 1 hora y media. Se realizan durante el curso lectivo_ de lunes a viernes y en horario de mañana. El grupo no debe superar las 22 personas.,NOConocido,Metro: Ciudad Universitaria (linea 6).  Bus: 132_ 82_ G_ U.  Bicimad: Estaciones 258 y 259 (avenida de la Complutense (Metro Ciudad Universitaria).,NOConocido,http://www.madrid.es/sites/v/index.jsp?vgnextchannel=bfa48ab43d6bb410VgnVCM100000171f5a0aRCRD&vgnextoid=58f9ef4d7f71c010VgnVCM1000000b205a0aRCRD,PLAZA RAMON Y CAJAL,PlazaRamonYCajalNum85756,NOConocido,Madrid,https://wikidata.org/entity/Q2807,Community of Madrid,https://wikidata.org/entity/Q5756,28040,28040N43113,Ciudad-universitaria,https://wikidata.org/entity/Q3319235,Moncloa-Aravaca,https://wikidata.org/entity/Q2017682,40.4445328804645,4445328804645N3946,-3.7262160043788155,913 941 797,museofar@ucm.es,Museos,NoIdentificado,Noidentificado,NOConocido,NOConocido,NOConocido
Spanish Museum,https://wikidata.org/entity/Q55188818,2107,Museo De La Guardia Civil,NOConocido,Horario: de lunes a viernes de 9 a 14 horas. Cerrado_ sabados_ domingos y festivos.,NOConocido,Metro: Guzman el Bueno (lineas 6_ 7). Bus: 2_ 45_ 44. Bicimad: Estaciones 256 (calle Beatriz de Bobadilla_ 2) y 203 (calle General Ampudia_ 2).,NOConocido,http://www.madrid.es/sites/v/index.jsp?vgnextchannel=bfa48ab43d6bb410VgnVCM100000171f5a0aRCRD&vgnextoid=003aef4d7f71c010VgnVCM1000000b205a0aRCRD,CALLE GUZMAN EL BUENO,CalleGuzmanElBuenoNum60266,110,Madrid,https://wikidata.org/entity/Q2807,Community of Madrid,https://wikidata.org/entity/Q5756,28003,28003N44542,Vallehermoso,https://wikidata.org/entity/Q6122685,Chamberi,https://wikidata.org/entity/Q1763370,40.44438523242585,44438523242585N6417,-3.712300118990835,915 146 000,dg-estuhistoricos-registro@guardiacivil.org,Museos,NoIdentificado,Noidentificado,NOConocido,NOConocido,NOConocido
Spanish Museum,https://wikidata.org/entity/Q55188818,2114,Museo De La Real Academia De Bellas Artes De San Fernando,Construido inicialmente para palacio de Don Juan de Goyeneche_ el edificio fue adquirido por la Academia de Bellas Artes en 1773 y reformado bajo la direccion de Fernando Chueca Goitia en 1973 y la fachada por Diego de Villanueva en 1774.,Coleccion permanente:  De martes a domingos y festivos de 10 a 14 horas.  Cerrado: todos los lunes y el mes de agosto.   Exposiciones temporales: consultar el apartado especifico de la exposicion temporal. Dias cerrados: 1 y 6 de enero; 1 y 30 de mayo; 9 de noviembre; 24_ 25 y 31 de diciembre.  En periodos vacacionales pueden sufrir cambios.,Sala de exposiciones - Accesible a personas con minusvalia (fisica).,Metro: Sol (lineas 1_ 2_ 3)_ Sevilla (linea 2).  Bus: 002_ 15_ 150_ 20_ 5_ 53_ M1_ 51_ 46_ 146.  Cercanias Renfe: Sol (lineas C3 y C4).  Bicimad: Estaciones 1a y 1b (Puerta del Sol_ 1) y 28 (calle Alcala_ 27).  Aparcamiento: Sevilla (41)_ calle Sevilla y calle Alcala.,Visitas guiadas (no grupos): 25 personas maximo (suspendidas temporalmente).  Martes_ jueves y viernes no festivos a las 11 horas_ excepto Navidad_ Semana Santa y agosto.   Visitas para grupos a otras instalaciones diferentes del Museo: jueves no festivos a las 11:30 horas.  Gratuitas y guiadas a los centros escolares y asociaciones a cargo de voluntarios culturales del Museo.   Previa solicitud:   Visitas de grupo: museo.visitas@rabasf.org. Visitas privadas a museo cerrado:  actos.culturales@rabasf.org.  Cumplimentando formulario de peticion de reservas en la web.,http://www.madrid.es/sites/v/index.jsp?vgnextchannel=bfa48ab43d6bb410VgnVCM100000171f5a0aRCRD&vgnextoid=924aef4d7f71c010VgnVCM1000000b205a0aRCRD,CALLE ALCALA,CalleAlcalaNum58118,13,Madrid,https://wikidata.org/entity/Q2807,Community of Madrid,https://wikidata.org/entity/Q5756,28014,28014N26913,Sol,https://wikidata.org/entity/Q2465181,Centro,https://wikidata.org/entity/Q1763376,40.41765456031193,41765456031193N3434,-3.7006553517170633,915 240 864,museo@rabasf.org,MonumentosEdificiosArtisticos,NoIdentificado,Noidentificado,NOConocido,NOConocido,NOConocido
Spanish Museum,https://wikidata.org/entity/Q55188818,2066,Museo Del Ferrocarril De Madrid,Edificio de caracter monumental. Proyectada por el ingeniero frances Émile Cachelievre e inaugurada el 30 de marzo de 1880_ la estacion de Delicias fue la primera gran estacion con caracter definitivo de Madrid.,De octubre a mayo:   Lunes a viernes_ de 09:30 a 15:00 horas. Sabados y festivos_ de 10:00 a 19:00 horas. Domingo_ de 10:00 a 15:00 horas.   De junio a septiembre:   Lunes a domingo_ de 10 a 15 horas.   Cerrado: 25 de diciembre_ 1 y 6 de enero.,Mercado de Motores : segundo sabado y domingo del mes_ de 11 a 21 horas (excepto agosto). El Museo cierra en su actividad ordinaria y el acceso es gratuito (www.mercadodemotores.es).    Feria del coleccionismo: primeros sabados de cada mes (excepto agosto) de 10 horas a 15 horas.  Mercadillo de Modelismo: primer domingo de cada mes (excepto el mes de agosto) de 10 a 14 horas.  Tren de jardin: todos los sabados_ de 11:30 a 13:30 horas (excepto julio y agosto).   Teatro familiar: sabados_ domingos y festivos_ a las 11:30 y 13 horas (excepto julio y agosto).,Metro: Delicias (linea 3).  Bus: 19_ 247_ 45_ 47_ 59_ 85_ 86_ 8_ 55_ 6.  Cercanias Renfe: Delicias (lineas C1_ C7_ C10 y Regional).  Bicimad: Estacion 172 (Bustamante_ 1).,NOConocido,http://www.madrid.es/sites/v/index.jsp?vgnextchannel=bfa48ab43d6bb410VgnVCM100000171f5a0aRCRD&vgnextoid=091c4291ae91f010VgnVCM2000000c205a0aRCRD,PASEO DELICIAS,PaseoDeliciasNum21819,61,Madrid,https://wikidata.org/entity/Q2807,Community of Madrid,https://wikidata.org/entity/Q5756,28045,28045N91178,Las-delicias,https://wikidata.org/entity/Q3773736,Arganzuela,https://wikidata.org/entity/Q2000929,40.400281290485566,400281290485566N3660,-3.693817192160563,915 390 085,NOConocido,MonumentosEdificiosArtisticos,NoIdentificado,Noidentificado,NOConocido,NOConocido,NOConocido
Spanish Museum,https://wikidata.org/entity/Q55188818,2058,Museo Del Prado,Construido inicialmente como Museo de Ciencias Naturales_ este edificio neoclasico fue transformado en pinacoteca de las Colecciones Reales en 1818 con colecciones de pintura_ dibujos_ grabados_ monedas y medallas desde el Romanico hasta el siglo XIX.,De lunes a sabado_ de 10 a 20 horas Domingos y festivos_ de 10 a 17 horas Cerrado los dias 1 de enero_ 1 de mayo y 25 de diciembre Horario reducido_ de 10 a 14 horas_ los dias 6 de enero_ 24 y 31 de diciembre Horario gratuito_ de lunes a sabado_ de 18 a 20 horas; domingos y festivos_ de 15 a 17 horas,NOConocido,Metro: Estacion del Arte (Atocha) (linea 1)_ Banco de España (linea 2)_ Retiro (linea 2)  Bus: 10_ 14_ 27_ 34_ 37_ 45  Renfe: Atocha  Bicimad: Estacion 68 (calle Espalter_ 1),Arquitecto: Juan de Villanueva (1785 - 1808)  Adecuacion: Antonio Lopez Aguado (1818 - 1831)  Ampliacion: Rafael Moneo (2000 - 2007),http://www.madrid.es/sites/v/index.jsp?vgnextchannel=bfa48ab43d6bb410VgnVCM100000171f5a0aRCRD&vgnextoid=060079262ef5d010VgnVCM1000000b205a0aRCRD,CALLE RUIZ DE ALARCON,CalleRuizDeAlarconNum4694,23,Madrid,https://wikidata.org/entity/Q2807,Community of Madrid,https://wikidata.org/entity/Q5756,28014,28014N67039,Jeronimos,https://wikidata.org/entity/Q10306766,Retiro,https://wikidata.org/entity/Q2002296,40.41358458131178,41358458131178N3083,-3.691325445518223,913 302 800,NOConocido,Museos,NoIdentificado,Noidentificado,NOConocido,NOConocido,NOConocido
Spanish Museum,https://wikidata.org/entity/Q55188818,2086,Museo Del Reloj Grassy,Arquitecto: Eladio Laredo Carranza (1916 - 1917). Fundado por el relojero frances Grassy en 1955_ este museo narra la historia de este aparato de medicion. Sus fondos_ coleccion privada_ consta de una amplia y variada coleccion de diferentes nacionalidades y los mas variados estilos.,El museo esta temporalmente cerrado.,NOConocido,Metro: Banco de España (linea 2)_ Sevilla (linea 2)_ Gran Via (Lineas 1 y 5).  Bus: 52_ 9_ 00_ 1_ 146_ 2_ 3_ 46_ 74_ 15_ 150_ 20_ 5_ 53_ 51.  Bicimad: Estacion 28 (calle Alcala_ 27).  Aparcamiento: Plaza del Rey (54).,NOConocido,http://www.madrid.es/sites/v/index.jsp?vgnextchannel=bfa48ab43d6bb410VgnVCM100000171f5a0aRCRD&vgnextoid=daeaef4d7f71c010VgnVCM1000000b205a0aRCRD,CALLE GRAN VIA,CalleGranViaNum48470,1,Madrid,https://wikidata.org/entity/Q2807,Community of Madrid,https://wikidata.org/entity/Q5756,28013,28013N18227,Cortes,https://wikidata.org/entity/Q2535637,Centro,https://wikidata.org/entity/Q1763376,40.41914770731552,41914770731552N7131,-3.69806583195521,915 321 007,NOConocido,Museos,NoIdentificado,Noidentificado,NOConocido,NOConocido,NOConocido
Spanish Museum,https://wikidata.org/entity/Q55188818,2059,Museo Del Romanticismo,NOConocido,Horario de invierno (de noviembre a abril) De martes a sabado: de 9:30 a 18:30. Domingos y festivos: de 10 a 15 horas  Horario de verano (de mayo a octubre) De martes a sabado: de 9:30 a 20:30. Domingos y festivos: de 10 a 15 horas  Cerrado: Todos los lunes_ 1 y 6 enero_ 1 mayo_ 9 noviembre_ 24_ 25 y 31 diciembre,Acceso para personas de movilidad reducida_ audioguias_ signoguias_ bucle magnetico_ lupas de aumento,Metro: Tribunal (lineas 1_ 10)_ Alonso Martinez (lineas 4_ 5_ 10)  Bus: 37_ 149_ 42_ 3  Renfe: Recoletos  Bicimad: Estacion 7 (calle Hortaleza_ 75) / Estacion 54 (calle Barcelo_ 7)  Parking: Barcelo (69)_ C/ Barcelo_ s/n,Descripcion monumental  Construido para casa palacio del Marques de Matallana por el arquitecto Manuel Rodriguez_ dentro de unas lineas clasicistas_ tiene algunas leves reminiscencias del barroco_ como las molduras en forma de orejeras en los balcones. Las estancias nobles se organizan en torno a dos patios cuadrados. Conserva un interesante jardin romantico. A finales del siglo XVIII el inmueble paso a estar habitado por los Condes de la Puebla del Maestre y despues_ desde junio de 1921_ fue sede de la Comisaria Regia de Turismo_ organismo creado por el II Marques de la Vega-Inclan. En 1924 se convirtio en Museo Romantico y desde entonces ha sido restaurado e intervenido en diversas ocasiones con motivo de su funcionamiento como museo.  Desde 2001 a 2009 el Museo fue reformado y puesto a punto_ en aplicacion de un plan museologico consistente en su renovacion_ ampliando su ambito tematico desde lo meramente literario hasta lo historico_ politico_ artistico y decorativo_ para dar una vision de conjunto de esta etapa de la vida española. Muestra la ambientacion de una casa romantica. Posee obras de los pintores mas importantes del siglo XIX (Goya_ Madrazo y otros) junto a esculturas_ muebles_ porcelanas_ abanicos y todo tipo de complementos decorativos que nos recuerdan la forma de vida de una familia burguesa del siglo XIX.,http://www.madrid.es/sites/v/index.jsp?vgnextchannel=bfa48ab43d6bb410VgnVCM100000171f5a0aRCRD&vgnextoid=706cef4d7f71c010VgnVCM1000000b205a0aRCRD,CALLE SAN MATEO,CalleSanMateoNum56892,13,Madrid,https://wikidata.org/entity/Q2807,Community of Madrid,https://wikidata.org/entity/Q5756,28004,28004N28693,Justicia,https://wikidata.org/entity/Q1992319,Centro,https://wikidata.org/entity/Q1763376,40.42585510296794,42585510296794N5974,-3.6987835425963063,914 481 045,informacion.romanticismo@cultura.gob.es,Museos,NoIdentificado,Noidentificado,NOConocido,NOConocido,NOConocido
Spanish Museum,https://wikidata.org/entity/Q55188818,6337393,Museo Del Seguro. Fundacion Mapfre,Ubicado en el edificio de Fundacion MAPFRE exhibe una amplia coleccion de piezas relacionadas con la historia de la actividad aseguradora desde el siglo XVIII hasta nuestros dias. Ofrece visitas guiadas y gratuitas para grupos.,Visitas en grupo previa reserva en su web.,NOConocido,Metro: Colon (linea 4).  Bus: 37_ 14_ 150_ 27_ 45_ 5_ 53_ C03.  Cercanias Renfe: Recoletos (Lineas C1_ C2_ C7_ C8_ C10).  Bicimad: Estaciones 26 (plaza de las Salesas_ 7) y 94 (paseo Recoletos_ 20).  Aparcamiento: Garaje Piamonte (96)_ calle Piamonte_ 16.,NOConocido,http://www.madrid.es/sites/v/index.jsp?vgnextchannel=bfa48ab43d6bb410VgnVCM100000171f5a0aRCRD&vgnextoid=479b95f8c72d5310VgnVCM2000000c205a0aRCRD,CALLE BARBARA DE BRAGANZA,CalleBarbaraDeBraganzaNum85222,14,Madrid,https://wikidata.org/entity/Q2807,Community of Madrid,https://wikidata.org/entity/Q5756,28004,28004N7717,Justicia,https://wikidata.org/entity/Q1992319,Centro,https://wikidata.org/entity/Q1763376,40.42326356132727,42326356132727N7295,-3.6922850587679505,NOConocido,NOConocido,Museos,NoIdentificado,Noidentificado,NOConocido,NOConocido,NOConocido
Spanish Museum,https://wikidata.org/entity/Q55188818,2115,Museo Del Traje. Centro De Investigacion Del Patrimonio Etnologico (cipe),Edificio de caracter monumental_ construido por Jaime Lopez de Asiain en 1969.,Salas de exposiciones   Martes a sabado_ de 9:30 a 19:00 horas Domingos y festivos_ de 10 a 15:00 horas  La taquilla finaliza su actividad de venta de entradas 15 minutos antes de la hora del cierre de la exposicion.  Noches de verano - Verano en el Museo   Los jueves de julio y agosto_ apertura extraordinaria: 9:30 - 22:30 horas  Cerrado: lunes_ 1 enero_ 1 y 15 mayo_ 24_ 25 y 31 diciembre,NOConocido,Metro: Ciudad Universitaria (linea 6)  Bus: 46_ 160_ 161_ U_ 82_ G_ 132_ 83_ 133_ 162,NOConocido,http://www.madrid.es/sites/v/index.jsp?vgnextchannel=bfa48ab43d6bb410VgnVCM100000171f5a0aRCRD&vgnextoid=053c4291ae91f010VgnVCM2000000c205a0aRCRD,AVENIDA JUAN DE HERRERA,AvenidaJuanDeHerreraNum7701,2,Madrid,https://wikidata.org/entity/Q2807,Community of Madrid,https://wikidata.org/entity/Q5756,28040,28040N55082,Ciudad-universitaria,https://wikidata.org/entity/Q3319235,Moncloa-Aravaca,https://wikidata.org/entity/Q2017682,40.439657822278555,439657822278555N1891,-3.7278378564088275,915 504 700,NOConocido,Museos,NoIdentificado,Noidentificado,NOConocido,NOConocido,NOConocido
