PK,NOMBRE,DESCRIPCION-ENTIDAD,HORARIO,EQUIPAMIENTO,TRANSPORTE,DESCRIPCION,ACCESIBILIDAD,CONTENT-URL,NOMBRE-VIA,CLASE-VIAL,TIPO-NUM,NUM,PLANTA,PUERTA,ESCALERAS,ORIENTACION,LOCALIDAD,PROVINCIA,CODIGO-POSTAL,BARRIO,DISTRITO,COORDENADA-X,COORDENADA-Y,LATITUD,LONGITUD,TELEFONO,FAX,EMAIL,TIPO,Column
2107,Museo de la Guardia Civil,,"Horario: de lunes a viernes de 9 a 14 horas. Cerrado, sábados, domingos y festivos.",,"Metro: Guzmán el Bueno (líneas 6, 7). Bus: 2, 45, 44. Bicimad: Estaciones 256 (calle Beatriz de Bobadilla, 2) y 203 (calle General Ampudia, 2).",,3,http://www.madrid.es/sites/v/index.jsp?vgnextchannel=bfa48ab43d6bb410VgnVCM100000171f5a0aRCRD&vgnextoid=003aef4d7f71c010VgnVCM1000000b205a0aRCRD,GUZMAN EL BUENO,CALLE,V,110,,,,,MADRID,MADRID,28003,VALLEHERMOSO,CHAMBERI,439594,4477325,40.44438523242585,-3.712300118990835,"915 146 000, extensiones 48495 (Oficina Museo), 48477 (Salas Museo)",,dg-estuhistoricos-registro@guardiacivil.org,/contenido/entidadesYorganismos/Museos,
2114,Museo de la Real Academia de Bellas Artes de San Fernando,"Construido inicialmente para palacio de Don Juan de Goyeneche, el edificio fue adquirido por la Academia de Bellas Artes en 1773 y reformado bajo la dirección de Fernando Chueca Goitia en 1973 y la fachada por Diego de Villanueva en 1774.","Colección permanente:  De martes a domingos y festivos de 10 a 14 horas.  Cerrado: todos los lunes y el mes de agosto.   Exposiciones temporales: consultar el apartado específico de la exposición temporal. Días cerrados: 1 y 6 de enero; 1 y 30 de mayo; 9 de noviembre; 24, 25 y 31 de diciembre.  En periodos vacacionales pueden sufrir cambios.",Sala de exposiciones - Accesible a personas con minusvalía (física).,"Metro: Sol (líneas 1, 2, 3), Sevilla (línea 2).  Bus: 002, 15, 150, 20, 5, 53, M1, 51, 46, 146.  Cercanías Renfe: Sol (líneas C3 y C4).  Bicimad: Estaciones 1a y 1b (Puerta del Sol, 1) y 28 (calle Alcalá, 27).  Aparcamiento: Sevilla (41), calle Sevilla y calle Alcalá.","Visitas guiadas (no grupos): 25 personas máximo (suspendidas temporalmente).  Martes, jueves y viernes no festivos a las 11 horas, excepto Navidad, Semana Santa y agosto.   Visitas para grupos a otras instalaciones diferentes del Museo: jueves no festivos a las 11:30 horas.  Gratuitas y guiadas a los centros escolares y asociaciones a cargo de voluntarios culturales del Museo.   Previa solicitud:   Visitas de grupo: museo.visitas@rabasf.org. Visitas privadas a museo cerrado:  actos.culturales@rabasf.org.  Cumplimentando formulario de petición de reservas en la web.",1,http://www.madrid.es/sites/v/index.jsp?vgnextchannel=bfa48ab43d6bb410VgnVCM100000171f5a0aRCRD&vgnextoid=924aef4d7f71c010VgnVCM1000000b205a0aRCRD,ALCALA,CALLE,V,13,,,,,MADRID,MADRID,28014,SOL,CENTRO,440558,4474350,40.41765456031193,-3.7006553517170633,915 240 864 (Centralita),915 241 034,museo@rabasf.org,/contenido/entidadesYorganismos/MonumentosEdificiosArtisticos,
2066,Museo del Ferrocarril de Madrid,"Edificio de carácter monumental. Proyectada por el ingeniero francés Émile Cacheliévre e inaugurada el 30 de marzo de 1880, la estación de Delicias fue la primera gran estación con carácter definitivo de Madrid.","De octubre a mayo:   Lunes a viernes, de 09:30 a 15:00 horas. Sábados y festivos, de 10:00 a 19:00 horas. Domingo, de 10:00 a 15:00 horas.   De junio a septiembre:   Lunes a domingo, de 10 a 15 horas.   Cerrado: 25 de diciembre, 1 y 6 de enero.","Mercado de Motores : segundo sábado y domingo del mes, de 11 a 21 horas (excepto agosto). El Museo cierra en su actividad ordinaria y el acceso es gratuito (www.mercadodemotores.es).    Feria del coleccionismo: primeros sábados de cada mes (excepto agosto) de 10 horas a 15 horas.  Mercadillo de Modelismo: primer domingo de cada mes (excepto el mes de agosto) de 10 a 14 horas.  Tren de jardín: todos los sábados, de 11:30 a 13:30 horas (excepto julio y agosto).   Teatro familiar: sábados, domingos y festivos, a las 11:30 y 13 horas (excepto julio y agosto).","Metro: Delicias (línea 3).  Bus: 19, 247, 45, 47, 59, 85, 86, 8, 55, 6.  Cercanías Renfe: Delicias (líneas C1, C7, C10 y Regional).  Bicimad: Estación 172 (Bustamante, 1).",,1,http://www.madrid.es/sites/v/index.jsp?vgnextchannel=bfa48ab43d6bb410VgnVCM100000171f5a0aRCRD&vgnextoid=091c4291ae91f010VgnVCM2000000c205a0aRCRD,DELICIAS,PASEO,V,61,,,,,MADRID,MADRID,28045,DELICIAS,ARGANZUELA,441124,4472418,40.400281290485566,-3.693817192160563,915 390 085,,,/contenido/entidadesYorganismos/MonumentosEdificiosArtisticos,
2058,Museo del Prado,"Construido inicialmente como Museo de Ciencias Naturales, este edificio neoclásico fue transformado en pinacoteca de las Colecciones Reales en 1818 con colecciones de pintura, dibujos, grabados, monedas y medallas desde el Románico hasta el siglo XIX.","De lunes a sábado, de 10 a 20 horas Domingos y festivos, de 10 a 17 horas Cerrado los días 1 de enero, 1 de mayo y 25 de diciembre Horario reducido, de 10 a 14 horas, los días 6 de enero, 24 y 31 de diciembre Horario gratuito, de lunes a sábado, de 18 a 20 horas; domingos y festivos, de 15 a 17 horas",,"Metro: Estación del Arte (Atocha) (línea 1), Banco de España (línea 2), Retiro (línea 2)  Bus: 10, 14, 27, 34, 37, 45  Renfe: Atocha  Bicimad: Estación 68 (calle Espalter, 1)",Arquitecto: Juan de Villanueva (1785 - 1808)  Adecuación: Antonio López Aguado (1818 - 1831)  Ampliación: Rafael Moneo (2000 - 2007),"1,4,6",http://www.madrid.es/sites/v/index.jsp?vgnextchannel=bfa48ab43d6bb410VgnVCM100000171f5a0aRCRD&vgnextoid=060079262ef5d010VgnVCM1000000b205a0aRCRD,RUIZ DE ALARCON,CALLE,V,23,,,,,MADRID,MADRID,28014,LOS JERONIMOS,RETIRO,441346,4473892,40.41358458131178,-3.691325445518223,913 302 800 / 902 10 70 77,,,/contenido/entidadesYorganismos/Museos,
2086,Museo del Reloj Grassy,"Arquitecto: Eladio Laredo Carranza (1916 - 1917). Fundado por el relojero francés Grassy en 1955, este museo narra la historia de este aparato de medición. Sus fondos, colección privada, consta de una amplia y variada colección de diferentes nacionalidades y los más variados estilos.",El museo está temporalmente cerrado.,,"Metro: Banco de España (línea 2), Sevilla (línea 2), Gran Vía (Líneas 1 y 5).  Bus: 52, 9, 00, 1, 146, 2, 3, 46, 74, 15, 150, 20, 5, 53, 51.  Bicimad: Estación 28 (calle Alcalá, 27).  Aparcamiento: Plaza del Rey (54).",,3,http://www.madrid.es/sites/v/index.jsp?vgnextchannel=bfa48ab43d6bb410VgnVCM100000171f5a0aRCRD&vgnextoid=daeaef4d7f71c010VgnVCM1000000b205a0aRCRD,GRAN VIA,CALLE,V,1,,,,,MADRID,MADRID,28013,CORTES,CENTRO,440779,4474514,40.41914770731552,-3.69806583195521,915 321 007,,,/contenido/entidadesYorganismos/Museos,
2059,Museo del Romanticismo,,"Horario de invierno (de noviembre a abril) De martes a sábado: de 9:30 a 18:30. Domingos y festivos: de 10 a 15 horas  Horario de verano (de mayo a octubre) De martes a sábado: de 9:30 a 20:30. Domingos y festivos: de 10 a 15 horas  Cerrado: Todos los lunes, 1 y 6 enero, 1 mayo, 9 noviembre, 24, 25 y 31 diciembre","Acceso para personas de movilidad reducida, audioguías, signoguías, bucle magnético, lupas de aumento","Metro: Tribunal (líneas 1, 10), Alonso Martínez (líneas 4, 5, 10)  Bus: 37, 149, 42, 3  Renfe: Recoletos  Bicimad: Estación 7 (calle Hortaleza, 75) / Estación 54 (calle Barceló, 7)  Parking: Barceló (69), C/ Barceló, s/n","Descripción monumental  Construido para casa palacio del Marqués de Matallana por el arquitecto Manuel Rodríguez, dentro de unas líneas clasicistas, tiene algunas leves reminiscencias del barroco, como las molduras en forma de orejeras en los balcones. Las estancias nobles se organizan en torno a dos patios cuadrados. Conserva un interesante jardín romántico. A finales del siglo XVIII el inmueble pasó a estar habitado por los Condes de la Puebla del Maestre y después, desde junio de 1921, fue sede de la Comisaría Regia de Turismo, organismo creado por el II Marqués de la Vega-Inclán. En 1924 se convirtió en Museo Romántico y desde entonces ha sido restaurado e intervenido en diversas ocasiones con motivo de su funcionamiento como museo.  Desde 2001 a 2009 el Museo fue reformado y puesto a punto, en aplicación de un plan museológico consistente en su renovación, ampliando su ámbito temático desde lo meramente literario hasta lo histórico, político, artístico y decorativo, para dar una visión de conjunto de esta etapa de la vida española. Muestra la ambientación de una casa romántica. Posee obras de los pintores más importantes del siglo XIX (Goya, Madrazo y otros) junto a esculturas, muebles, porcelanas, abanicos y todo tipo de complementos decorativos que nos recuerdan la forma de vida de una familia burguesa del siglo XIX.","1,6",http://www.madrid.es/sites/v/index.jsp?vgnextchannel=bfa48ab43d6bb410VgnVCM100000171f5a0aRCRD&vgnextoid=706cef4d7f71c010VgnVCM1000000b205a0aRCRD,SAN MATEO,CALLE,V,13,,,,,MADRID,MADRID,28004,JUSTICIA,CENTRO,440725,4475259,40.42585510296794,-3.6987835425963063,914 481 045 / 914 480 163,914 456 940,informacion.romanticismo@cultura.gob.es,/contenido/entidadesYorganismos/Museos,
6337393,Museo del Seguro. Fundación Mapfre,Ubicado en el edificio de Fundación MAPFRE exhibe una amplia colección de piezas relacionadas con la historia de la actividad aseguradora desde el siglo XVIII hasta nuestros días. Ofrece visitas guiadas y gratuitas para grupos.,Visitas en grupo previa reserva en su web.,,"Metro: Colón (línea 4).  Bus: 37, 14, 150, 27, 45, 5, 53, C03.  Cercanías Renfe: Recoletos (Líneas C1, C2, C7, C8, C10).  Bicimad: Estaciones 26 (plaza de las Salesas, 7) y 94 (paseo Recoletos, 20).  Aparcamiento: Garaje Piamonte (96), calle Piamonte, 16.",,3,http://www.madrid.es/sites/v/index.jsp?vgnextchannel=bfa48ab43d6bb410VgnVCM100000171f5a0aRCRD&vgnextoid=479b95f8c72d5310VgnVCM2000000c205a0aRCRD,BARBARA DE BRAGANZA,CALLE,V,14,,,,,MADRID,MADRID,28004,JUSTICIA,CENTRO,441273,4474967,40.42326356132727,-3.6922850587679505,,,,/contenido/entidadesYorganismos/Museos,
2115,Museo del Traje. Centro de Investigación del Patrimonio Etnológico (CIPE),"Edificio de carácter monumental, construido por Jaime López de Asiaín en 1969.","Salas de exposiciones   Martes a sábado, de 9:30 a 19:00 horas Domingos y festivos, de 10 a 15:00 horas  La taquilla finaliza su actividad de venta de entradas 15 minutos antes de la hora del cierre de la exposición.  Noches de verano - Verano en el Museo   Los jueves de julio y agosto, apertura extraordinaria: 9:30 - 22:30 horas  Cerrado: lunes, 1 enero, 1 y 15 mayo, 24, 25 y 31 diciembre",,"Metro: Ciudad Universitaria (línea 6)  Bus: 46, 160, 161, U, 82, G, 132, 83, 133, 162",,"1,4",http://www.madrid.es/sites/v/index.jsp?vgnextchannel=bfa48ab43d6bb410VgnVCM100000171f5a0aRCRD&vgnextoid=053c4291ae91f010VgnVCM2000000c205a0aRCRD,JUAN DE HERRERA,AVENIDA,V,2,,,,,MADRID,MADRID,28040,CIUDAD UNIVERSITARIA,MONCLOA-ARAVACA,438273,4476811,40.439657822278555,-3.7278378564088275,915 504 700,,,/contenido/entidadesYorganismos/Museos,
2061,Palacio Real de El Pardo,"Recinto en el que se conserva el Palacio, construido sobre el castillo del siglo XV, la Casita del Príncipe, del siglo XVIII y la Quinta del Duque de Arco (Palacete que fue Casa de Labor y sus tierras). Desde 1983 ha sido adecuado para residencia de Jefes de Estado extranjeros en visita oficial.",Consultar la  web  o telefónicamente.,,Bus: 601 (Madrid - Colonia Mingorrubio).,,1,http://www.madrid.es/sites/v/index.jsp?vgnextchannel=bfa48ab43d6bb410VgnVCM100000171f5a0aRCRD&vgnextoid=9f9def4d7f71c010VgnVCM1000000b205a0aRCRD,MANUEL ALONSO,CALLE,V,8,,,,,MADRID,MADRID,28048,EL PARDO,FUENCARRAL-EL PARDO,434247,4485823,40.520522342970146,-3.7762390614462853,914 548 700 (Información general),,info@patrimonionacional.es,/contenido/entidadesYorganismos/MonumentosEdificiosArtisticos,
2062,Palacio Real de Madrid,"Construido sobre el solar del antiguo Alcázar tras un incendio en 1734. Proyectado por Juvara en 1735 y construido por Sachet de 1738 a 1764 bajo las influencias del clasicismo barroco. A partir de 1770, Sabatini añadió el ala sudeste y realizó la gran escalera. Es de destacar el gran patio que articula el edificio y la fachada principal que aloja el balcón y Escudo Real.","Lunes a sábado, de 10 a 18 horas. Domingos y festivos, de 10 a 16 horas.  Para cierres durante el año o motivados por la celebración de actos oficiales o festividad en el municipio consultar la web.  Jardines del Campo del Moro   Todos los días, de 10 a 18 horas.","Relevo solemne de la Guardia en el Palacio Real de Madrid  La Guardia Real realiza este relevo los primeros miércoles de cada mes, a las 12 horas (excepcionalmente puede haber cambios, consultar en http://www.guardiareal.org/. El acto tiene una duración aproximada de 50 minutos, y se desarrolla en la Plaza de la Armería, finalizando con un concierto de la Unidad de Música en la Puerta del Príncipe (calle Bailén). La entrada es libre y gratuita, hasta completar aforo. Se accede por el Arco de Santiago (calle Bailén esquina con Requena). No se celebra en enero, agosto y septiembre, ni cuando coincide con actos oficiales.   Relevo de la Guardia en la Puerta del Príncipe del Palacio Real de Madrid  El acto se lleva a cabo todos los miércoles y sábados del mes, desde las 11 hasta las 14 horas, exceptuando del 19 de junio al 18 de septiembre que será desde las 10 hasta las 12 horas, siempre y cuando los actos oficiales o la climatología lo permitan. Tiene lugar en la calle Bailén.","Metro: Ópera (líneas 2, 5 y Ramal Ópera Norte).  Bus: 3, 25, 39, 148.  Cercanías: Príncipe Pío.  Bicimad: Estación 36 (Plaza de Ramales, 1).",,1,http://www.madrid.es/sites/v/index.jsp?vgnextchannel=bfa48ab43d6bb410VgnVCM100000171f5a0aRCRD&vgnextoid=47ddef4d7f71c010VgnVCM1000000b205a0aRCRD,BAILEN,CALLE,V,0,,,,,MADRID,MADRID,28013,PALACIO,CENTRO,439540,4474703,40.42075212551193,-3.712699107286406,914 548 700 (Información general),,info@patrimonionacional.es,/contenido/entidadesYorganismos/MonumentosEdificiosArtisticos,
2079,Panteón de Hombres Ilustres,La construcción de este edificio responde a dos de las constantes de fines de siglo: la arquitectura historicista y la escultura funeraria. En él reposan trece personajes ilustres de la historia política y militar española.,De martes a sábado de 10 a 14 y de 16 a 18:30 horas Domingos y festivos de 10 a 15 horas Cerrado todos los lunes del año,,"Metro: Estación del Arte (Atocha) (línea 1)  Bus: 10, 14, 24, 32, 37, 54, 57, 141, 26, C1, C2, 102  Renfe: Atocha",,1,http://www.madrid.es/sites/v/index.jsp?vgnextchannel=bfa48ab43d6bb410VgnVCM100000171f5a0aRCRD&vgnextoid=361cef4d7f71c010VgnVCM1000000b205a0aRCRD,JULIAN GAYARRE,CALLE,V,3,,,,,MADRID,MADRID,28014,PACIFICO,RETIRO,442012,4473070,40.40622617519116,-3.683413041846525,914 548 700 (Información general),,info@patrimonionacional.es,/contenido/entidadesYorganismos/MonumentosEdificiosArtisticos,
3362,Parroquia Santa Cruz,,,,"Metro: Sol (líneas 1, 2 y 3), Tirso de Molina (línea 1).  Bus: 50, 26, 32, 6, 65, 18, 23, 17, 002, M1, 31.  Cercanías Renfe: Sol (líneas C3,C4 y Regional).  Bicimad: Estaciones 32 (plaza de la Provincia, 1), 34 (plaza de Jacinto Benavente), 40 (plaza del Conde Romanones, 9).  Aparcamientos: Plaza Mayor (55) y Jacinto Benavente (15) plaza Jacinto Benavente.",,3,http://www.madrid.es/sites/v/index.jsp?vgnextchannel=bfa48ab43d6bb410VgnVCM100000171f5a0aRCRD&vgnextoid=40e0b069a541f010VgnVCM1000000b205a0aRCRD,ATOCHA,CALLE,V,6,,,,,MADRID,MADRID,28012,SOL,CENTRO,440165,4474015,40.414608558946085,-3.705255882048698,913 691 239,,santacruz@archimadrid.es,/contenido/entidadesYorganismos/MonumentosEdificiosArtisticos,
2213,Planetario de Madrid,"Inaugurado el 29 de septiembre de 1986, es un centro dependiente del Área de Cultura, Turismo y Deporte del Ayuntamiento de Madrid. Durante los años 2016/2017 fue sometido a una profunda renovación tanto tecnológica como de las instalaciones y edificio, posible en virtud de un acuerdo de colaboración entre el Ayuntamiento de Madrid y la Obra Social &amp;ldquo;la Caixa&amp;rdquo; &amp;ndash; que incluye dotación de contenidos, renovación de exposiciones y la realización de actividades varias en el campo de la divulgación científica. Siempre con el fin de contribuir a la difusión de la astronomía y de la ciencia en general, tanto entre escolares como entre el público de cualquier edad y condición, posee una variada oferta de proyecciones audiovisuales, exposiciones y actividades (talleres, cursos, conferencias, observaciones públicas...). Las proyecciones que se ofrecen en el Planetario de Madrid se renuevan periódicamente y tienen una duración aproximada de 30 minutos. Existen dos programaciones básicas diferentes: una activa durante el verano y época de vacaciones escolares, y otra durante el curso escolar. Durante el curso escolar, las proyecciones de las mañanas de los días lectivos se reservan a escolares.   Video de presentación del centro   Folleto informativo (PDF)  Planetario en  Google Maps","Horario del centro (curso escolar 2021-22, adaptación a CoviD-19): De martes a domingo, de 10:00 a 13:30 y de 17:00 (*) a 19:30.  Acceso permitido sólo a público con entradas ya adquiridas. Visita pautada.  Cerrado: Todos los lunes del año. Días 1 y 6 de enero; 1 de mayo; 24, 25 y 31 de diciembre. (*) Viernes, de 17:30 a 19:30 h.","Sala de Proyección. Planta calle. Para acceder a ella es necesario adquirir una entrada.   Cuatro áreas expositivas de acceso gratuito, distribuidas en dos plantas:   Sala de Astrónomos. Planta baja. Vestíbulo de la planta baja. Vestíbulo de la planta calle. Zona Audiovisual con pantalla de retroproyección. Planta calle.      Sala de Video. Planta baja, en donde se desarrollan los talleres ofertados.","Metro: Méndez Álvaro (línea 6). Bus: 148, 156. BICIMAD: Estación 177 (Calle Bolívar 3).  Planetario en  Google Maps",,"1,6",http://www.madrid.es/sites/v/index.jsp?vgnextchannel=bfa48ab43d6bb410VgnVCM100000171f5a0aRCRD&vgnextoid=c9c5b069a541f010VgnVCM1000000b205a0aRCRD,PLANETARIO,AVENIDA,V,16,,,,,MADRID,MADRID,28045,LEGAZPI,ARGANZUELA,441868,4471523,40.392279999540044,-3.684956957448299,"914 673 461 (reserva grupos)                                                                                                                                                                                                                                                                                                                                                                                                                                               
914 673 898 (contestador automático de información)",,buzon@planetmad.es,/contenido/entidadesYorganismos/Planetarios,
3359,Real Basílica San Francisco el Grande,"Conjunto conventual que sustituyó al monasterio franciscano medieval, construido por Francisco de las Cabezas entre 1761 y 1768, que fue relevado por Antonio Polo y que concluye Francisco Sabatini en 1784 donde se exponen colecciones de pinturas de los siglos XVII al XIX.","Visita Guiada Museo:    De martes a viernes de 10:30 a 12:30 y de 16 a 18 horas.  Julio, agosto y septiembre: de martes a viernes de 10:30 a 12:30 y de 17 a 19 horas.   Sábados de 10:30 a 12:30 y de 16 a 18 horas (entrada libre sin guía).",,"Metro: La Latina (línea 5) , Puerta de Toledo (línea 5).  Bus: 002, 17, 18, 23, 35, 60.  Bicimad: Estación 37 (Plaza San Francisco, 5).  Aparcamiento: Parking VOT (97), Ventosa.",,3,http://www.madrid.es/sites/v/index.jsp?vgnextchannel=bfa48ab43d6bb410VgnVCM100000171f5a0aRCRD&vgnextoid=ef8d0713fb71c010VgnVCM1000000b205a0aRCRD,SAN BUENAVENTURA,CALLE,V,1,,,,,MADRID,MADRID,28005,PALACIO,CENTRO,439377,4473603,40.41084005024222,-3.714503845728281,913 653 800,,,/contenido/entidadesYorganismos/MonumentosEdificiosArtisticos,
2087,Real Fábrica de Tapices,,"Visitas guiadas: Lunes a viernes a las 10, 11, 12 y 13 horas en castellano. Duración de la visita 40 minutos. Es obligatorio efectuar una reserva previa mediante el correo electrónico visitasmuseo@realfabricadetapices.com.",,"Metro: Menéndez Pelayo (línea 1).  Bus: 10, 14, 26, 32, C1, C2, 141, 24, 37, 54, 57, 152.  Bicimad: Estación 79 (avenida de menéndez Pelayo, 38).",,3,http://www.madrid.es/sites/v/index.jsp?vgnextchannel=bfa48ab43d6bb410VgnVCM100000171f5a0aRCRD&vgnextoid=53cbff632081c010VgnVCM1000000b205a0aRCRD,FUENTERRABIA,CALLE,V,2,,,,,MADRID,MADRID,28014,PACIFICO,RETIRO,442087,4473054,40.406087329011655,-3.682515969574079,914 340 550,,informacion@realfabricadetapices.com,/contenido/entidadesYorganismos/MonumentosEdificiosArtisticos,
4707297,Real Monasterio de Santa Isabel,"El Real Monasterio de Santa Isabel está situado en Madrid, dentro de la ciudad histórica, en una gran manzana, próxima a Atocha. Santa Isabel agrupa dos fundaciones, un colegio de niñas, establecido por Felipe II, y un convento de clausura de monjas agustinas recoletas, fundado por la esposa de Felipe III, doña Margarita de Austria. La arquitectura de la iglesia se debe a Gómez de Mora, de mediados del siglo XVIII. En la clausura se conservan numerosas obras pictóricas de los siglos XVII y XVIII.",El acceso al templo sólo es posible en horario de culto.,,"Metro: Estación del Arte (Atocha) (línea 1)  Bus: 26, 32, 6, 27, 34, C1  Renfe: Atocha",,3,http://www.madrid.es/sites/v/index.jsp?vgnextchannel=bfa48ab43d6bb410VgnVCM100000171f5a0aRCRD&vgnextoid=545b544a249c6110VgnVCM1000000b205a0aRCRD,SANTA ISABEL,CALLE,V,48,,,,,MADRID,MADRID,28012,EMBAJADORES,CENTRO,440655,4473736,40.41213027498252,-3.6994547941964946,914 548 700 (Información general),,info@patrimonionacional.es,/contenido/entidadesYorganismos/MonumentosEdificiosArtisticos,
3349,Real Monasterio de la Encarnación,"Edificio construído por Juan Gómez de Mora de 1611 a 1616 como monasterio anejo al Alcázar Real, modelo de lo que se ha dado en llamar barroco madrileño. Cuenta con la reliquia de San Pantaleón.",Consultar horarios.,,"Metro: Ópera (líneas 2, 5 y Ramal Ópera Príncipe Pío), Plaza de España (líneas 3, 10)  Bus: 3, 25, 39, 148  Bicimad: Estación 25 a y b (Plaza Celenque, 1)",,3,http://www.madrid.es/sites/v/index.jsp?vgnextchannel=bfa48ab43d6bb410VgnVCM100000171f5a0aRCRD&vgnextoid=72ad0713fb71c010VgnVCM1000000b205a0aRCRD,ENCARNACION,PLAZA,V,1,,,,,MADRID,MADRID,28013,PALACIO,CENTRO,439634,4474582,40.41967800877382,-3.711567962866152,914 548 700 (Información general),,info@patrimonionacional.es,/contenido/entidadesYorganismos/MonumentosEdificiosArtisticos,
3348,Real Monasterio de las Descalzas Reales,"Convento fundado por la Princesa Juana de Austria, transformando un antiguo palacio de su madre Isabel de Portugal.",Consultar la  web  o telefónicamente.,,"Metro: Ópera (líneas 2, 5 y Ramal Ópera-Príncipe Pío).  Bus: 3, 25, 39, 148.  Bicimad: Estación 25 a y b (Plaza de Celenque).",,3,http://www.madrid.es/sites/v/index.jsp?vgnextchannel=bfa48ab43d6bb410VgnVCM100000171f5a0aRCRD&vgnextoid=12e113db5b71c010VgnVCM1000000b205a0aRCRD,DESCALZAS,PLAZA,V,3,,,,,MADRID,MADRID,28013,SOL,CENTRO,440087,4474418,40.418233359889484,-3.706213134639163,914 548 700,,info@patrimonionacional.es,/contenido/entidadesYorganismos/MonumentosEdificiosArtisticos,
